{
  "schema_version": 2,
  "schema_url": "https://raw.githubusercontent.com/Amarel-Taylor-Scott/github-radar/main/schemas/project-radar-manifest-v2.schema.json",
  "generated_at": "2026-10-16T13:57:41+00:00",
  "source_commit": "3be7e4681beb10f091c291443bc991cb64f6591d",
  "file_count": 76,
  "total_bytes": 51937733,
  "files": [
    {
      "scope": "feed",
      "path": "README.md",
      "bytes": 3923,
      "sha256": "6020cf513d5c1272d5c953dc21207b90d0189e4d4fc8e55806c58621ce697723"
    },
    {
      "scope": "feed",
      "path": "accessibility.json",
      "bytes": 15005,
      "sha256": "07c4d245a2f5f1372b6ed8e2b845394e3077bcfd2fa43a17035fa022e7e06ff4"
    },
    {
      "scope": "feed",
      "path": "accessibility.md",
      "bytes": 64736,
      "sha256": "8ed3d715eb9abe5c52de893b93f1fcedc89b566e692117051ea4fb3eebe620a6"
    },
    {
      "scope": "feed",
      "path": "ai-agents.json",
      "bytes": 15483,
      "sha256": "9e8d8ba93604d051efdf3521a16d3234a58b9246d89becae379ae82724f1fec5"
    },
    {
      "scope": "feed",
      "path": "ai-agents.md",
      "bytes": 67369,
      "sha256": "0ba4ffde49382ba9df9e0564cd18567def4662b8b6e60a1d783e017cb92e98bc"
    },
    {
      "scope": "feed",
      "path": "ai-engineering.json",
      "bytes": 15591,
      "sha256": "ab70c7ca0508b3348babd348fd19d713d2cc40cc95523fbeae98a526077fe30e"
    },
    {
      "scope": "feed",
      "path": "ai-engineering.md",
      "bytes": 68357,
      "sha256": "5eeba4b3be95519e8b0a8eb6eef7e1f2a0e3b36ef2a13e5d9ef41cde47a70a56"
    },
    {
      "scope": "feed",
      "path": "audit.json",
      "bytes": 13024,
      "sha256": "a9597f724e9bec0e816f3e332c9ca2b10f9fc4e5fbf5d7ff39d701f9ce88fe64"
    },
    {
      "scope": "feed",
      "path": "audit.md",
      "bytes": 2216,
      "sha256": "6a3dc340fad4229f405aa6fbb0bc890ccd34fd0fa463a5b464e772643a7ccd99"
    },
    {
      "scope": "feed",
      "path": "bioinformatics.json",
      "bytes": 14133,
      "sha256": "4bb2a64a98c9d8863529f9adcb0447ec71e4595069b9002d1ca14b0650721622"
    },
    {
      "scope": "feed",
      "path": "bioinformatics.md",
      "bytes": 60554,
      "sha256": "6b7c8ccc4a7d9b78a2a1d93ca6457d10e96ed6b67085a80f1119336717a40064"
    },
    {
      "scope": "feed",
      "path": "business-automation.json",
      "bytes": 12981,
      "sha256": "dd6085483406bf24d96da618422220a16a55cca141c1414cb04d3a4cff968fb0"
    },
    {
      "scope": "feed",
      "path": "business-automation.md",
      "bytes": 69409,
      "sha256": "c8d2712f543ba9b15bdec3dea17000877ff6c478bc8db1ca35e16164d4915f38"
    },
    {
      "scope": "feed",
      "path": "changes.json",
      "bytes": 1330545,
      "sha256": "f6ddada923ab9686800956a8578dd4a98432736f051041c211204c0abe295740"
    },
    {
      "scope": "feed",
      "path": "changes.md",
      "bytes": 21152,
      "sha256": "eed47fb9760cc4c24af56231d1e190a68d2b3dd09ddb427cf86f132c5762723b"
    },
    {
      "scope": "feed",
      "path": "civic-tech.json",
      "bytes": 13276,
      "sha256": "80f2282e8db59633a090b62e16681d4afaeb46bc15bc4dbf72c6f6547b278b05"
    },
    {
      "scope": "feed",
      "path": "civic-tech.md",
      "bytes": 61642,
      "sha256": "811084e09155d8d7672612a0766adbccd57eac1ae5057f7ef721879ffc8ae066"
    },
    {
      "scope": "feed",
      "path": "cloud-native.json",
      "bytes": 13840,
      "sha256": "0bc3592a344568d52d0ad61c2f9f9f45db05fb93d8a6bea1443dbda65b52b8d8"
    },
    {
      "scope": "feed",
      "path": "cloud-native.md",
      "bytes": 60508,
      "sha256": "a92e0d96090995b33a0f818b762b0258d3af9f375439b17072a8f03f3207c225"
    },
    {
      "scope": "feed",
      "path": "creative-computing.json",
      "bytes": 14628,
      "sha256": "3ecb510954dcc8da61d4ee632f2cdf46a5c0ab2111d09338619da94457632db5"
    },
    {
      "scope": "feed",
      "path": "creative-computing.md",
      "bytes": 64360,
      "sha256": "5211c36431c4315343c57a7f7c04671438dab493436615577c913556060a8773"
    },
    {
      "scope": "feed",
      "path": "cybersecurity.json",
      "bytes": 14832,
      "sha256": "336b35fd30abb6b6a59b9f3ee3244cdc210eb60e7cba1393a3419639acf751d3"
    },
    {
      "scope": "feed",
      "path": "cybersecurity.md",
      "bytes": 66358,
      "sha256": "c4d1b7d5589e7256951b79eefe162e4183d396a5b930daf6f01b137d39408d02"
    },
    {
      "scope": "feed",
      "path": "data-engineering.json",
      "bytes": 13498,
      "sha256": "7a3f8537d3179009354b03e868179ef3f022d42439717f5e6d8fa976eb7d63b3"
    },
    {
      "scope": "feed",
      "path": "data-engineering.md",
      "bytes": 63465,
      "sha256": "08b7f8247303906babf13dea4cfeee2e23e5823d7afde1ef03c8293cda6f1216"
    },
    {
      "scope": "feed",
      "path": "databases.json",
      "bytes": 13227,
      "sha256": "045c4b7cbfeed03cb4b6fd3ff22303f098d175cc1cae88c11c743436540ec074"
    },
    {
      "scope": "feed",
      "path": "databases.md",
      "bytes": 63780,
      "sha256": "87a1bcfd5e255112e218403a06d6dbf1fa4ebf5b49bf78c7df18ccbf05dd773c"
    },
    {
      "scope": "feed",
      "path": "developer-tools.json",
      "bytes": 13703,
      "sha256": "993af7cfe055719abd19e5129654f2e32ff744b01dc2ab13f78390b1c4a7cb9a"
    },
    {
      "scope": "feed",
      "path": "developer-tools.md",
      "bytes": 66748,
      "sha256": "26d7617897347ca1ad4d64634bee673ea2d21c81f1eac1fc6187e759b1fe3067"
    },
    {
      "scope": "feed",
      "path": "game-development.json",
      "bytes": 12173,
      "sha256": "6529cfc89c68e3b3710eea35ba14e6725fc3deb7b8665b20d6593cf0c36d6332"
    },
    {
      "scope": "feed",
      "path": "game-development.md",
      "bytes": 59154,
      "sha256": "371d34573237db4e1958a777c7cc1b822935a44277442f5a4d08fe8453c97201"
    },
    {
      "scope": "feed",
      "path": "geospatial.json",
      "bytes": 13340,
      "sha256": "3c9d6a018f120d53a277cd552bc0bd965082b48232652276629a84c8f45aee88"
    },
    {
      "scope": "feed",
      "path": "geospatial.md",
      "bytes": 63611,
      "sha256": "f0057bb24211c0d29e5298930ad2ca224ca411705357cb4a6170c708a5417205"
    },
    {
      "scope": "feed",
      "path": "history.json",
      "bytes": 19112010,
      "sha256": "794953a7e19f337bc2d9f9140d8a61dfd577605f1eac9a47ada31e985e9a0c69"
    },
    {
      "scope": "feed",
      "path": "interesting-projects.json",
      "bytes": 98931,
      "sha256": "f45a1d252d70eb60722813ecf8d908fc5cd764d8491fc2ccb4cbdb18c5e82faf"
    },
    {
      "scope": "feed",
      "path": "interesting-projects.md",
      "bytes": 69233,
      "sha256": "4ec83dea5b796814d0888708bc829d722fe0e1fc6d70773a573ab65d61dc30f4"
    },
    {
      "scope": "feed",
      "path": "latest.json",
      "bytes": 10360455,
      "sha256": "384c7d33290466702029b1d0b4ba0bc3b1f2913946ea2457a28321d070c7e708"
    },
    {
      "scope": "feed",
      "path": "projects.atom",
      "bytes": 12592,
      "sha256": "8c0821f1b42c900c888d352d2975e5a038ca1911bb039b1c1fb2c96f1bab83fd"
    },
    {
      "scope": "feed",
      "path": "review-queue.json",
      "bytes": 152272,
      "sha256": "3925b316282b76a459290fe05f9721fa19cca7c58e667bef0836806d4b459eb7"
    },
    {
      "scope": "feed",
      "path": "review-queue.md",
      "bytes": 33539,
      "sha256": "9a4b848de307a50ca8c5c770a6d43f2ddad7dede6952d39db95000066ee91ba4"
    },
    {
      "scope": "feed",
      "path": "robotics.json",
      "bytes": 13493,
      "sha256": "5ff498db3f34c8320f99ec62bab24ae37753987f3f5954daaf034c4e60d24e1b"
    },
    {
      "scope": "feed",
      "path": "robotics.md",
      "bytes": 60044,
      "sha256": "c8489af8fff1da01fbfca1fd93d02a4ca8f5d815918bc49b1895ad334a5b7420"
    },
    {
      "scope": "feed",
      "path": "scientific-computing.json",
      "bytes": 14232,
      "sha256": "3b19e0edf5dd6775adfeeaef36169431a4ab58b009fc0e1fc37e2f3862bd596b"
    },
    {
      "scope": "feed",
      "path": "scientific-computing.md",
      "bytes": 64481,
      "sha256": "4c500359e2e1d37afdf31015e09771fa5051f70fbd8a4bd92c842a3845fe052e"
    },
    {
      "scope": "feed",
      "path": "self-hosted.json",
      "bytes": 13958,
      "sha256": "90e2c932a3735fdbed40e296c5568720343eb45324d5134a9313a873df97a4a9"
    },
    {
      "scope": "feed",
      "path": "self-hosted.md",
      "bytes": 68805,
      "sha256": "80aff134608b93a2408b3754bbfcd344f7893167e714db07c4529671007ff0ec"
    },
    {
      "scope": "feed",
      "path": "status.json",
      "bytes": 1193,
      "sha256": "cefee42f73fca358914bb37256fba973400385be28b6b054959a6ceac92fe1b2"
    },
    {
      "scope": "site",
      "path": "audit.json",
      "bytes": 13024,
      "sha256": "a9597f724e9bec0e816f3e332c9ca2b10f9fc4e5fbf5d7ff39d701f9ce88fe64"
    },
    {
      "scope": "site",
      "path": "audit.md",
      "bytes": 2216,
      "sha256": "6a3dc340fad4229f405aa6fbb0bc890ccd34fd0fa463a5b464e772643a7ccd99"
    },
    {
      "scope": "site",
      "path": "badges/accessibility.json",
      "bytes": 129,
      "sha256": "5a443c8b7913d749f8d32aeb059d452fe8bea55bbf39767341af8a972fe997f2"
    },
    {
      "scope": "site",
      "path": "badges/ai-agents.json",
      "bytes": 100,
      "sha256": "78f225352d9030dc07b57e926cca3dd6c52290dc01f166518d59d5fc0e0cfa7e"
    },
    {
      "scope": "site",
      "path": "badges/ai-engineering.json",
      "bytes": 105,
      "sha256": "45d468ca0b405c8b91bcab043ad2b2b6c3479a3c2e43847403139d18d7b468f2"
    },
    {
      "scope": "site",
      "path": "badges/bioinformatics.json",
      "bytes": 131,
      "sha256": "8a236a4adbbf197d04874b54d7d0b38f72f21cc84f84252091c75ffc7a226672"
    },
    {
      "scope": "site",
      "path": "badges/business-automation.json",
      "bytes": 110,
      "sha256": "a912b2ce81db4b84bdbee4819a3b93f089f5f8124ff613526a8ef6d1b7753782"
    },
    {
      "scope": "site",
      "path": "badges/civic-tech.json",
      "bytes": 107,
      "sha256": "b55798d7634c8fb898ce3f57447e736b00abbb0098724d56057242151fffc299"